{
  "$schema": "https://json-schema.org/draft/2020-12/schema",
  "$id": "https://example.invalid/networklab/schemas/summary/1.0",
  "title": "NetworkLab Summary v1.0",
  "type": "object",
  "additionalProperties": false,
  "required": [
    "schema_version",
    "report_type",
    "synthetic",
    "run_id",
    "run_uuid",
    "correlation_id",
    "role",
    "module_id",
    "scope_id",
    "target_id",
    "server_id",
    "profile",
    "started_at",
    "finished_at",
    "duration_ms",
    "status",
    "exit_code",
    "tests",
    "errors",
    "warnings"
  ],
  "properties": {
    "schema_version": {
      "const": "1.0"
    },
    "synthetic": {
      "type": "boolean"
    },
    "run_id": {
      "type": "string",
      "pattern": "^\\d{4}-\\d{2}-\\d{2}-\\d{2}-\\d{2}-\\d{2}-[a-z0-9][a-z0-9-]*(?:-\\d{2})?$"
    },
    "run_uuid": {
      "type": "string",
      "pattern": "^[0-9a-f]{8}-[0-9a-f]{4}-4[0-9a-f]{3}-[89ab][0-9a-f]{3}-[0-9a-f]{12}$"
    },
    "correlation_id": {
      "type": [
        "string",
        "null"
      ],
      "pattern": "^[0-9a-f]{8}-[0-9a-f]{4}-4[0-9a-f]{3}-[89ab][0-9a-f]{3}-[0-9a-f]{12}$"
    },
    "role": {
      "enum": [
        "C",
        "S"
      ]
    },
    "module_id": {
      "enum": [
        "c-inventory",
        "c-standalone",
        "c-paired",
        "c-proxy",
        "c-collect",
        "s-inventory",
        "s-toolbox",
        "s-service",
        "s-scheduler"
      ]
    },
    "scope_id": {
      "type": "string",
      "pattern": "^[a-z0-9](?:[a-z0-9-]{0,61}[a-z0-9])?$"
    },
    "target_id": {
      "type": [
        "string",
        "null"
      ],
      "pattern": "^[a-z0-9](?:[a-z0-9-]{0,61}[a-z0-9])?$"
    },
    "server_id": {
      "type": [
        "string",
        "null"
      ],
      "pattern": "^[a-z0-9](?:[a-z0-9-]{0,61}[a-z0-9])?$"
    },
    "profile": {
      "enum": [
        "quick",
        "standard",
        "deep",
        null
      ]
    },
    "started_at": {
      "type": "string",
      "pattern": "^\\d{4}-\\d{2}-\\d{2}T\\d{2}:\\d{2}:\\d{2}\\+08:00$"
    },
    "finished_at": {
      "type": [
        "string",
        "null"
      ],
      "pattern": "^\\d{4}-\\d{2}-\\d{2}T\\d{2}:\\d{2}:\\d{2}\\+08:00$"
    },
    "duration_ms": {
      "type": [
        "integer",
        "null"
      ],
      "minimum": 0
    },
    "status": {
      "enum": [
        "completed",
        "failed",
        "timeout",
        "skipped",
        "interrupted",
        "partial",
        "not_implemented"
      ]
    },
    "exit_code": {
      "type": "integer",
      "minimum": 0,
      "maximum": 255
    },
    "report_type": {
      "const": "summary"
    },
    "tests": {
      "type": "array",
      "items": {
        "type": "object",
        "additionalProperties": false,
        "required": [
          "test_id",
          "attempt",
          "status",
          "evidence_scope",
          "data_provenance",
          "tool",
          "network",
          "parameters",
          "metrics",
          "raw_files",
          "errors",
          "warnings"
        ],
        "properties": {
          "test_id": {
            "type": "string",
            "pattern": "^[a-z0-9][a-z0-9-]*$"
          },
          "attempt": {
            "type": "integer",
            "minimum": 1
          },
          "status": {
            "enum": [
              "completed",
              "failed",
              "timeout",
              "skipped",
              "interrupted",
              "partial",
              "not_implemented"
            ]
          },
          "evidence_scope": {
            "enum": [
              "local",
              "public_path",
              "c_s_direct",
              "proxy_path",
              "third_party_service"
            ]
          },
          "data_provenance": {
            "enum": [
              "observed",
              "configured",
              "provider_declared",
              "unknown"
            ]
          },
          "tool": {
            "type": "object",
            "additionalProperties": false,
            "required": [
              "name",
              "version"
            ],
            "properties": {
              "name": {
                "type": "string",
                "minLength": 1
              },
              "version": {
                "type": [
                  "string",
                  "null"
                ]
              }
            }
          },
          "network": {
            "type": "object",
            "additionalProperties": false,
            "required": [
              "ip_family",
              "transport",
              "direction",
              "proxy_mode"
            ],
            "properties": {
              "ip_family": {
                "enum": [
                  4,
                  6,
                  null
                ]
              },
              "transport": {
                "enum": [
                  "TCP",
                  "UDP",
                  "ICMP",
                  "TLS",
                  "HTTP",
                  "QUIC",
                  null
                ]
              },
              "direction": {
                "enum": [
                  "C_TO_S",
                  "S_TO_C",
                  "C_TO_PUBLIC",
                  "S_TO_PUBLIC",
                  "PROXY_TO_TARGET",
                  "LOCAL",
                  null
                ]
              },
              "proxy_mode": {
                "enum": [
                  "direct",
                  "proxy",
                  "unknown",
                  null
                ]
              }
            }
          },
          "parameters": {
            "type": "object"
          },
          "metrics": {
            "type": "object"
          },
          "raw_files": {
            "type": "array",
            "items": {
              "type": "string",
              "pattern": "^[a-z0-9][a-z0-9._-]*$"
            },
            "uniqueItems": true
          },
          "errors": {
            "type": "array",
            "items": {
              "type": "object",
              "additionalProperties": false,
              "required": [
                "code",
                "message"
              ],
              "properties": {
                "code": {
                  "type": "string",
                  "minLength": 1
                },
                "message": {
                  "type": "string",
                  "minLength": 1
                },
                "test_id": {
                  "type": [
                    "string",
                    "null"
                  ]
                }
              }
            }
          },
          "warnings": {
            "type": "array",
            "items": {
              "type": "object",
              "additionalProperties": false,
              "required": [
                "code",
                "message"
              ],
              "properties": {
                "code": {
                  "type": "string",
                  "minLength": 1
                },
                "message": {
                  "type": "string",
                  "minLength": 1
                },
                "test_id": {
                  "type": [
                    "string",
                    "null"
                  ]
                }
              }
            }
          }
        }
      }
    },
    "errors": {
      "type": "array",
      "items": {
        "type": "object",
        "additionalProperties": false,
        "required": [
          "code",
          "message"
        ],
        "properties": {
          "code": {
            "type": "string",
            "minLength": 1
          },
          "message": {
            "type": "string",
            "minLength": 1
          },
          "test_id": {
            "type": [
              "string",
              "null"
            ]
          }
        }
      }
    },
    "warnings": {
      "type": "array",
      "items": {
        "type": "object",
        "additionalProperties": false,
        "required": [
          "code",
          "message"
        ],
        "properties": {
          "code": {
            "type": "string",
            "minLength": 1
          },
          "message": {
            "type": "string",
            "minLength": 1
          },
          "test_id": {
            "type": [
              "string",
              "null"
            ]
          }
        }
      }
    }
  }
}
