{
  "schema_version": "1.0",
  "synthetic": true,
  "run_id": "2026-10-21-18-31-05-local",
  "run_uuid": "d762a3bc-12ac-4567-8b9e-aabbccddeeff",
  "correlation_id": null,
  "role": "C",
  "module_id": "c-inventory",
  "scope_id": "local",
  "target_id": null,
  "server_id": null,
  "profile": null,
  "started_at": "2026-10-21T18:31:05+08:00",
  "finished_at": "2026-10-21T18:31:05+08:00",
  "duration_ms": 0,
  "status": "completed",
  "exit_code": 0,
  "report_type": "summary",
  "tests": [
    {
      "test_id": "schema-smoke",
      "attempt": 1,
      "status": "completed",
      "evidence_scope": "local",
      "data_provenance": "observed",
      "tool": {
        "name": "networklab-example-fixture",
        "version": "1.0"
      },
      "network": {
        "ip_family": null,
        "transport": null,
        "direction": "LOCAL",
        "proxy_mode": null
      },
      "parameters": {
        "synthetic_only": true
      },
      "metrics": {},
      "raw_files": [
        "c-synthetic-local-2026-10-21-18-31-05.txt"
      ],
      "errors": [],
      "warnings": []
    }
  ],
  "errors": [],
  "warnings": []
}
